ResponseId;IC1;IC2;IC3;Q1;A1;O1;A2;A2_8_TEXT;A2_a;A2_b;A2_b_5_TEXT;CB1;RB;CB3;DF1;DF2;SB1;TP1;OS1;MS;Q2;Q3;Q4;Q5;Q6;Q7;Q8;Q135_First Click;Q135_Last Click;Q135_Page Submit;Q135_Click Count;Q10;Q10_6_TEXT;Q11_1;Q11_2;Q11_3;Q11_4;Q11_5;Q11_6;Q11_7;Q11_8;Q18;Q19;Q19_12_TEXT;Q20;Q21;Q22;Q22_11_TEXT;Q23;Q23_10_TEXT;Q142;Q12;Q13;Q14;Q15;Q16;Q24;A7_1;A7_2;A7_3;A7_4;A7_5;A7_6;A8;A9_1;A9_2;A9_3;A9_4;A9_5;A9_6;GENDER;GENDER_TEXT;AGE_ITEM;AGE_NUM;ETH_HISP;ETH_R;A6_15_TEXT;Q25
R_26mpnDiwPSS7CSW;Yes;Yes;Yes;Yes;School of Medicine & Health Sciences;;Student;;No;Bachelors (B.A., B.S., etc.);;"I keep a journal of my passwords. 
 
 I have a standard password that is strong. I mix it up with special characters at the end.
 
 I change my passwords at least once per month.";I wrote my passwords down on paper or other physical media.;No;;;;;;;"That’s it. I keep a journal in my desk that is always locked. 
 
 I do memorize them. But I use the journal to document the changes.";I have a standard password that was assigned to me years ago.;I have used a variation of this code for a while.;No;About equally secure;I have super strong passwords that are randomly selected. Nobody could guess them.;I do not use a password manager.;1.307;19.778;21.289;6;School/class;;Somewhat Disagree;Somewhat Disagree;Strongly Disagree;Strongly Agree;Strongly Disagree;Strongly Disagree;Somewhat Disagree;Neither agree nor disagree;;;;;;;;;;;Who is the manager? I do not trust anyone.;Yes;I feel that hackers can outsmart the manager. I just used it one time years ago.;;Possibly.;Slightly likely;Strongly Disagree;Strongly Disagree;Strongly Disagree;Strongly Disagree;Strongly Disagree;Strongly Disagree;None of the above;Full Understanding;Full Understanding;Full Understanding;High understanding;Full Understanding;Full Understanding;Woman;;My age is:;54;No, not of Hispanic, Latino/a/x, or Spanish origin;Black or African American;;I want my email to be entered into the $10 Amazon gift card raffle
R_28Ma5ho6wl8IH8r;Yes;Yes;Yes;Yes;Other;GW IT;Leadership (provost/dean/president’s office);;;;;I used the 1Password cloud service and the iCloud Keychain to secure my passwords.;I remembered my passwords without writing them down or storing them digitally,I saved my passwords in the browser (for example, passwords saved in Chrome),I used a third-party password manager (for example, Lastpass or Onepass),I used a system-provided password manager (for example, Apple's Keychain);Yes;;;No;Yes;Yes;My main password system is 1password. I store all of my passwords here, as well as credit card data and other important codes. However, being an Apple user (Macbook Pro, iPhone, iPad) I rely on the Apple keychain for some less important passwords.;Not at this time.;I used a password generation tool in 1password.;I wanted it to be random, but I wanted it to be short enough that I could remember it.;No;About equally secure;With 2sa on most accounts, I felt comfortable using a shorter random password for this login.;I save my passwords in the browser (for example, passwords saved in Chrome).,I use a third-party manager (for example, Lastpass or Onepass).,I use a system provided password manager (for example, Apple's Keychain).;16.694;23.444;24.738;3;Other People (friends, family, etc, but not at work);;Somewhat Agree;Somewhat Agree;Neither agree nor disagree;Somewhat Agree;Somewhat Disagree;Neither agree nor disagree;Somewhat Agree;Somewhat Agree;To reduce the tendency to use the same passwords on multiple accounts.;1Password;;Extremely satisfied;I let the password manager create and store the password;Synchronizing passwords for access across multiple devices;;Entering passwords on an incompatible device where the password manger cannot be installed;;Sometimes the browser is locked down and the password manager will not work appropriately. At that point, it is a pain to type a long random password.;;;;;;Extremely likely;Agree;Agree;Agree;Agree;Somewhat Agree;Somewhat Agree;None of the above;High understanding;Full Understanding;High understanding;Full Understanding;Medium understanding;High understanding;Man;;My age is:;39;No, not of Hispanic, Latino/a/x, or Spanish origin;White;;None of the above
R_Q0LfnG5njnrRhEl;Yes;Yes;Yes;Yes;Columbian College of Arts & Sciences;;Full-time Faculty;;;;;Keychain application across Apple devices, using suggested randomly generated passwords.;I used a system-provided password manager (for example, Apple's Keychain);No;;;;;Yes;;I also use a different password to unlock Apple Keychain than I use to unlock my user account/devices.;A three-part password with each part memorable to me but no part a regular word. Overall password contains upper case, lower case, numbers and special characters.;So it is complex but memorable to me, so I can still type it without looking it up when necessary. Some locations on GW systems still seem to not work with system password management, so it is helpful to still have a memorable password for those instances. This issue of having to type in a password on GW systems is decreasing as SSO has been expanded.;Yes;About equally secure;I use the same password management strategy across all accounts, inlacing my GW one. I use two factor authentication everywhere it is available, including my GW account.;I use a system provided password manager (for example, Apple's Keychain).;36.02;36.02;38.523;1;Other;Long time ago, from knowing my OS.;Neither agree nor disagree;Neither agree nor disagree;Neither agree nor disagree;Somewhat Agree;Strongly Disagree;Strongly Disagree;Strongly Agree;Strongly Agree;Ease of using and filling complex, randomly generated passwords.;Apple Keychain;;Extremely satisfied;I let the password manager create and store the password;Not having to type my passwords (autofill);;Does not work correctly on some websites;;The password manager sometimes does not correctly trigger with filling or remembering newly created passwords. I usually blame the website (it is usually old websites clearly using old code/web technology).;;;;;;Extremely unlikely;Strongly Agree;Strongly Agree;Strongly Agree;Strongly Agree;Strongly Agree;Agree;None of the above;Full Understanding;Full Understanding;Full Understanding;Full Understanding;Full Understanding;Full Understanding;Man;;My age is:;45;Prefer not to disclose;Prefer not to disclose;;None of the above
R_bq5UHYaVnBqfCxj;Yes;Yes;Yes;Yes;Trachtenberg School of Public Policy & Public Administration;;Student;;No;Graduate (M.S.E, M.S., M.A, M.F.A., etc.);;Write them down in a notebook;I remembered my passwords without writing them down or storing them digitally,I wrote my passwords down on paper or other physical media.;Yes;;;;;;For really important/secure I have unique passwords I write down. For ones that are not as important I have a few that I cycle between. Ones that require me to change, I have to write them down to remember;No;Memory;There is the Microsoft validation that texts the code;No;Somewhat less secure;The security authenticate through share point;I do not use a password manager.;2.642;22.249;23.371;8;Other People (friends, family, etc, but not at work);;Somewhat Disagree;Strongly Disagree;Neither agree nor disagree;Neither agree nor disagree;Neither agree nor disagree;Neither agree nor disagree;Somewhat Disagree;Somewhat Disagree;;;;;;;;;;;What if you forget your password to the password manager or it gets hacked..;No;;No;;Slightly likely;Somewhat Disagree;Somewhat Agree;Disagree;Strongly Disagree;Disagree;Agree;None of the above;Medium understanding;High understanding;Low understanding;No understanding;Medium understanding;Full Understanding;Woman;;My age is:;29;No, not of Hispanic, Latino/a/x, or Spanish origin;White;;I am willing to be contacted via email for follow-up studies,I want my email to be entered into the $10 Amazon gift card raffle
R_32VGnJHHzXhr2AJ;Yes;Yes;Yes;Yes;Graduate School of Education & Human Development;;Full-time Faculty;;;;;This year I have had to start a google document to keep track;I remembered my passwords without writing them down or storing them digitally,I stored my passwords in a digital file or files,I saved my passwords in the browser (for example, passwords saved in Chrome);Yes;No;Yes;No;;;As I have kore devices now. I use memory less and written passwords more;No;Things I would remember;Because I have to enter password so many times;Yes;Much more secure;The Authenticator keeps logging me out and back in;I save my passwords in the browser (for example, passwords saved in Chrome).,I use a system provided password manager (for example, Apple's Keychain).;1.7;21.031;22.791;9;I don’t know (don’t remember, not sure);;Somewhat Agree;Somewhat Agree;Strongly Disagree;Strongly Disagree;Somewhat Agree;Somewhat Agree;Neither agree nor disagree;Somewhat Agree;I hate entering passwords;Chrome;;Moderately satisfied;I create the password myself, and the password manager stores it for me;Not having to type my passwords (autofill);;Entering passwords on an incompatible device where the password manger cannot be installed;;No;;;;;;Moderately likely;Disagree;Somewhat Agree;Somewhat Disagree;Disagree;Somewhat Agree;Somewhat Disagree;None of the above;Medium understanding;High understanding;Low understanding;Low understanding;Low understanding;Medium understanding;Woman;;Prefer not to disclose;;No, not of Hispanic, Latino/a/x, or Spanish origin;White;;None of the above
R_294bNU5Ts5u8Roj;Yes;Yes;Yes;Yes;School of Engineering & Applied Science;;Staff (non-faculty/administrative);;;;;Honestly, I use similar passwords across accounts.;I remembered my passwords without writing them down or storing them digitally,I reset my password every time I log in rather than remembering my password,I stored my passwords in a digital file or files,I saved my passwords in the browser (for example, passwords saved in Chrome),I used a third-party password manager (for example, Lastpass or Onepass);Yes;No;No;No;Yes;;I started by memorizing my passwords then I moved to having my browser remember them, then I wrote them in a file and finally I tried to use a password manager.;No.;It is similar to my past ones.;Easiest to remember.;No;Unsure;I think it is secure enough.;I save my passwords in the browser (for example, passwords saved in Chrome).,I use a third-party manager (for example, Lastpass or Onepass).,I use a system provided password manager (for example, Apple's Keychain).;65.845;68.564;87.096;3;Work;;Somewhat Disagree;Strongly Disagree;Neither agree nor disagree;Somewhat Agree;Somewhat Disagree;Somewhat Disagree;Somewhat Disagree;Somewhat Disagree;Too many passwords!;Firefox;;Moderately satisfied;I create the password myself, and the password manager stores it for me;Not having to memorize passwords;;I have security concerns;;They are general security concerns.;;;;;;Extremely likely;Somewhat Agree;Somewhat Agree;Disagree;Disagree;Somewhat Agree;Somewhat Agree;None of the above;Full Understanding;Full Understanding;Low understanding;Low understanding;Medium understanding;High understanding;Woman;;My age is:;57;Yes, Another Hispanic, Latino/a or Spanish origin;White;;I am willing to be contacted via email for follow-up studies,I want my email to be entered into the $10 Amazon gift card raffle
R_3HulKIKFAofzi1U;Yes;Yes;Yes;Yes;Elliott School of International Affairs;;Student;;Yes;Bachelors (B.A., B.S., etc.);;For the most part, they are all similar, with slight variations to meet password requirements, or because I had to change the password;I remembered my passwords without writing them down or storing them digitally,I stored my passwords in a digital file or files,I saved my passwords in the browser (for example, passwords saved in Chrome),I used a system-provided password manager (for example, Apple's Keychain),I wrote my passwords down on paper or other physical media.;Yes;No;No;Yes;;Yes;For some, I just remembered it, then for other passwords that are important but I don’t use frequently, I wrote them down so I have access to them if necessary;No;I used my go-to password, with a variation;So that I would easily remember it, but it would also fit the password requirements;Yes;About equally secure;I don’t think anyone would try to hack my GW account, and not many people know my passwords;I save my passwords in the browser (for example, passwords saved in Chrome).,I use a system provided password manager (for example, Apple's Keychain).;10.189;24.532;26.31;7;Other People (friends, family, etc, but not at work),School/class;;Strongly Disagree;Strongly Disagree;Strongly Agree;Strongly Agree;Strongly Disagree;Strongly Disagree;Neither agree nor disagree;Somewhat Agree;Convenience;Apple Keychain;;Extremely satisfied;I create the password myself, and the password manager stores it for me;Not having to type my passwords (autofill);;I have security concerns;;Depending on the device, no extra security measures are necessary. On the iPhone or the iPad, face-ID is used as an extra measure, or touch-ID. And if those aren’t available, the phone password can be entered. I think the new MacBooks might require touch-ID, but my MacBook Air is from early 2015 and for most things, it auto fills automatically and no extra steps are necessary.;;;;;;Moderately likely;Disagree;Somewhat Disagree;Disagree;Neither agree nor disagree;Disagree;Somewhat Agree;None of the above;High understanding;High understanding;Low understanding;High understanding;Low understanding;No understanding;Woman;;My age is:;19;Yes, Another Hispanic, Latino/a or Spanish origin;White;;I am willing to be contacted via email for follow-up studies,I want my email to be entered into the $10 Amazon gift card raffle
R_296cLllG7R0PJIO;Yes;Yes;Yes;Yes;Trachtenberg School of Public Policy & Public Administration;;Full-time Faculty;;;;;I use unique passwords for every account. I write them down.;I used a third-party password manager (for example, Lastpass or Onepass),I wrote my passwords down on paper or other physical media.;No;;;;No;;I mostly use paper. I tried the password manager but I didn’t really understand it and I got overwhelmed so I abandoned it.;Nope! Thanks and good luck with your study. Pleas share the results when you’re done!;Combination of something that matters to me, a date, and a symbol;I think I was told that a combo of words numbers and symbols was a good idea.;No;Somewhat less secure;I just haven’t updated it to use a more modern strategy;I do not use a password manager.;7.79;50.848;52.147;11;Other People (friends, family, etc, but not at work);;Strongly Agree;Somewhat Agree;Strongly Disagree;Strongly Disagree;Strongly Agree;Strongly Agree;Neither agree nor disagree;Strongly Disagree;;;;;;;;;;;I tried one and was overwhelmed. I also don’t understand what happens when a password expires and I reset it. Does it sync with the password manager automatically? Do I have to do something? What if I change my password using a device that doesn’t integrate with the password manager?;Yes;I stopped within a few days.;;Yes, because smart people tell me they’re the best we have right now.;Moderately likely;Somewhat Agree;Somewhat Agree;Somewhat Agree;Somewhat Agree;Somewhat Agree;Somewhat Agree;None of the above;Full Understanding;Full Understanding;Full Understanding;Full Understanding;Full Understanding;Full Understanding;Woman;;My age is:;41;No, not of Hispanic, Latino/a/x, or Spanish origin;White;;I am willing to be contacted via email for follow-up studies
R_2pS8niYnQHfTgL3;Yes;Yes;Yes;Yes;Elliott School of International Affairs;;Student;;No;Bachelors (B.A., B.S., etc.);;I make every password in the same format.;I remembered my passwords without writing them down or storing them digitally,I reset my password every time I log in rather than remembering my password;Yes;;;;;;I use an I phone so I utilize the save password or I just reset my password if I forgot;I only use a certain number at the end of my passwords so I don't get confuse;my name and numbers;It is easy to remember;Yes;About equally secure;if it is too easy, someone might hack and if it is too hard, I can forget;I save my passwords in the browser (for example, passwords saved in Chrome).;2.397;13.417;28.055;5;Media (Internet, TV, radio, etc),I don’t know (don’t remember, not sure);;Somewhat Disagree;Strongly Agree;Strongly Agree;Strongly Agree;Strongly Disagree;Strongly Disagree;Strongly Agree;Somewhat Disagree;I cannot remember all of the passwords I use;Chrome;;Moderately satisfied;I create the password myself, and the password manager stores it for me;Not having to type my passwords (autofill);;Saves passwords that I do not want to save;;;;;;;;Extremely likely;Somewhat Agree;Somewhat Agree;Somewhat Agree;Somewhat Agree;Somewhat Agree;Strongly Disagree;None of the above;Medium understanding;High understanding;No understanding;High understanding;No understanding;No understanding;Woman;;My age is:;19;No, not of Hispanic, Latino/a/x, or Spanish origin;Korean;;None of the above
R_1EaoF2GktDZHSDK;Yes;Yes;Yes;Yes;School of Engineering & Applied Science;;Full-time Faculty;;;;;I use a password manager, LastPass;I remembered my passwords without writing them down or storing them digitally,I reset my password every time I log in rather than remembering my password,I used a third-party password manager (for example, Lastpass or Onepass),I wrote my passwords down on paper or other physical media.;Yes;;;;Yes;;Now I just put everything in Lastpass, but before I discovered Lastpass, I memorized the key passwords, wrote some down on paper, and for the ones I don't use often, I just reset every time.;No;I used a word and then changed it with symbols etc. I did it myself.;Because I need to be able to memorize it, since I need it all the time, and I didn't want to memorize an auto-generated string of characters.;Yes;Somewhat less secure;Because I needed to memorize it and type it all the time.;I use a third-party manager (for example, Lastpass or Onepass).;22.253;22.253;27.42;1;Other People (friends, family, etc, but not at work);;Strongly Agree;Somewhat Agree;Somewhat Agree;Somewhat Agree;Somewhat Disagree;Neither agree nor disagree;Neither agree nor disagree;Strongly Disagree;It is easier and I can use better passwords;LastPass;;Slightly satisfied;I let the password manager create and store the password;Not having to memorize passwords;;Does not work correctly on some websites;;Lastpass only sometimes works for autofilling passwords, and it ought to work all the time. This is extremely annoying as it takes a lot of time to go and look things up.;;;;;;Moderately likely;Somewhat Disagree;Neither agree nor disagree;Neither agree nor disagree;Disagree;Somewhat Agree;Strongly Disagree;None of the above;Medium understanding;High understanding;No understanding;High understanding;No understanding;Low understanding;Woman;;My age is:;39;No, not of Hispanic, Latino/a/x, or Spanish origin;White;;None of the above
R_9ogvtG6U9YwoAk9;Yes;Yes;Yes;Yes;Other;GWPD;Staff (non-faculty/administrative);;;;;Single Sign on;I remembered my passwords without writing them down or storing them digitally;Yes;;;;;;;No;Something meaningful but a combination of numbers, letters, and characters.;Always used that system;Yes;About equally secure;It works;I save my passwords in the browser (for example, passwords saved in Chrome).;57.849;57.849;61.986;1;I don’t know (don’t remember, not sure);;Somewhat Disagree;Somewhat Disagree;Neither agree nor disagree;Somewhat Agree;Somewhat Disagree;Somewhat Disagree;Neither agree nor disagree;Somewhat Agree;Convenience;Chrome;;Moderately satisfied;I create the password myself, and the password manager stores it for me;Not having to type my passwords (autofill);;I have security concerns;;While it is convenient, anything can be hacked. Especially large databases which are frequent targets.;;;;;;Moderately unlikely;Somewhat Agree;Agree;Agree;Neither agree nor disagree;Somewhat Agree;Somewhat Agree;None of the above;Full Understanding;Full Understanding;High understanding;High understanding;High understanding;Full Understanding;Man;;Prefer not to disclose;;No, not of Hispanic, Latino/a/x, or Spanish origin;White;;I want my email to be entered into the $10 Amazon gift card raffle
R_28JabtqiH1znVww;Yes;Yes;Yes;Yes;School of Medicine & Health Sciences;;Other;Staff and Adjunct Faculty;;;;I manage my university passwords in the same fashion as my personal ones. I have an app that safely and securely stores my passwords in the event that I cannot recall my logins and passwords.;I remembered my passwords without writing them down or storing them digitally,I used a third-party password manager (for example, Lastpass or Onepass),I used a system-provided password manager (for example, Apple's Keychain);No;;;;No;No;Generally I remember my passwords and logins. There are several sites that I use very infrequently in the year and for those I will go to my Lastpass account to help me remember my information. I do not maintain the same passwords for account so Lastpass helps with managing this.;N/A;Prefer not to disclose. I use phrases when setting passwords up.;General practice;Yes;About equally secure;n/a;I use a third-party manager (for example, Lastpass or Onepass).,I use a system provided password manager (for example, Apple's Keychain).;14.284;15.43;22.768;2;Other;Previous employer when I had a security clearance;Neither agree nor disagree;Neither agree nor disagree;Neither agree nor disagree;Somewhat Agree;Somewhat Disagree;Neither agree nor disagree;Somewhat Agree;Somewhat Agree;To maintain all of my account information.;Apple Keychain;;Extremely satisfied;I create the password myself, and the password manager stores it for me;Having unique passwords;;None of the above;;Maintaining the account;;;;;;Extremely likely;Somewhat Agree;Agree;Agree;Neither agree nor disagree;Agree;Somewhat Agree;None of the above;Full Understanding;Full Understanding;High understanding;High understanding;Full Understanding;Full Understanding;Woman;;My age is:;43;No, not of Hispanic, Latino/a/x, or Spanish origin;White;;None of the above
R_3O0K4D5K5qzvIno;Yes;Yes;Yes;Yes;School of Medicine & Health Sciences;;Staff (non-faculty/administrative);;;;;1password;I used a third-party password manager (for example, Lastpass or Onepass);No;;;;Yes;;;No;Used multiple words with a hyphen then some numbers;Because it’s secure;No;About equally secure;Because it’s a 20 or more character password with a bunch of random stuff;I use a third-party manager (for example, Lastpass or Onepass).;2.287;20.637;21.446;12;Other People (friends, family, etc, but not at work);;Strongly Agree;Somewhat Agree;Neither agree nor disagree;Somewhat Agree;Strongly Disagree;Strongly Disagree;Somewhat Agree;Neither agree nor disagree;Security;1Password;;Extremely satisfied;I let the password manager create and store the password;Generate strong passwords;;Other;I had to remember my Apple ID one time and it led to a bunch of shit where I couldn’t fix my phone because I couldn’t remember the password and couldn’t pull up the password on a broken phone screen.;I ended up buying a new phone;;;;;;Extremely unlikely;Strongly Agree;Strongly Agree;Agree;Agree;Somewhat Agree;Strongly Agree;None of the above;Medium understanding;Medium understanding;Medium understanding;Medium understanding;Medium understanding;Medium understanding;Man;;My age is:;26;No, not of Hispanic, Latino/a/x, or Spanish origin;White;;I am willing to be contacted via email for follow-up studies
R_suOHSozyUVtw2fn;Yes;Yes;Yes;Yes;Graduate School of Education & Human Development;;Student;;No;Graduate (M.S.E, M.S., M.A, M.F.A., etc.);;I use the 1Password application across all my computers and devices;I remembered my passwords without writing them down or storing them digitally,I stored my passwords in a digital file or files,I saved my passwords in the browser (for example, passwords saved in Chrome),I used a third-party password manager (for example, Lastpass or Onepass),I used a system-provided password manager (for example, Apple's Keychain),I wrote my passwords down on paper or other physical media.;No;No;No;No;Yes;No;I have , in the past, used a variety of ways to store passwords, but after so much struggling to keep passwords safe and diverse, I went with 1Password;No;I used a phrase in my head and inserted special characters and numbers, ensure no actual words were included. Additionally, my password is 15 characters;Strength;No;About equally secure;Any password breach can lead to others, so all my passwords are equally strong;I use a third-party manager (for example, Lastpass or Onepass).;16.925;16.925;30.708;1;I don’t know (don’t remember, not sure);;Strongly Agree;Strongly Agree;Strongly Disagree;Somewhat Disagree;Somewhat Agree;Somewhat Agree;Somewhat Agree;Somewhat Disagree;Secure storage of the multiple passwords;1Password;;Extremely satisfied;I let the password manager create and store the password;Having unique passwords;;None of the above;;sometimes it is just a pain, not fast enough;;;;;;Extremely likely;Strongly Agree;Strongly Agree;Strongly Agree;Strongly Agree;Strongly Agree;Strongly Agree;None of the above;Full Understanding;Full Understanding;Full Understanding;Full Understanding;Full Understanding;Full Understanding;Woman;;My age is:;58;No, not of Hispanic, Latino/a/x, or Spanish origin;White;;I am willing to be contacted via email for follow-up studies
