ResponseId;IC1;IC2;IC3;Q1;A1;O1;A2;A2_8_TEXT;A2_a;A2_b;A2_b_5_TEXT;CB1;RB;CB3;DF1;DF2;SB1;TP1;OS1;MS;Q2;Q3;Q4;Q5;Q6;Q7;Q8;Q135_First Click;Q135_Last Click;Q135_Page Submit;Q135_Click Count;Q10;Q10_6_TEXT;Q11_1;Q11_2;Q11_3;Q11_4;Q11_5;Q11_6;Q11_7;Q11_8;Q18;Q19;Q19_12_TEXT;Q20;Q21;Q22;Q22_11_TEXT;Q23;Q23_10_TEXT;Q142;Q12;Q13;Q14;Q15;Q16;Q24;A7_1;A7_2;A7_3;A7_4;A7_5;A7_6;A8;A9_1;A9_2;A9_3;A9_4;A9_5;A9_6;GENDER;GENDER_TEXT;AGE_ITEM;AGE_NUM;ETH_HISP;ETH_R;A6_15_TEXT;Q25
R_ApVnSMSU8NwMhUZ;Yes;Yes;Yes;Yes;Other;Controller's Team/EVP CFO;Staff (non-faculty/administrative);;;;;I have google save the words on my computer.;I saved my passwords in the browser (for example, passwords saved in Chrome);Yes;;;No;;;;I also use my cell phone to save passwords and use finger print;"various months with either ""+"" or ""!""";easy to remember;Yes;About equally secure;I know that it is secured.;I save my passwords in the browser (for example, passwords saved in Chrome).;12.49;26.951;27.52;4;Work;;Neither agree nor disagree;Neither agree nor disagree;Somewhat Disagree;Somewhat Agree;Somewhat Disagree;Somewhat Disagree;Neither agree nor disagree;Neither agree nor disagree;rather than writing each password, it is easier to use the manger;Chrome;;Moderately satisfied;I create the password myself, and the password manager stores it for me;Not having to type my passwords (autofill);;I have security concerns;;i do get messages that my password has been exposed and ask to change the password;;;;;;Extremely likely;Agree;Agree;Agree;Agree;Agree;Neither agree nor disagree;None of the above;Medium understanding;Medium understanding;Medium understanding;Low understanding;Low understanding;Low understanding;Woman;;My age is:;50;No, not of Hispanic, Latino/a/x, or Spanish origin;Asian Indian;;I am willing to be contacted via email for follow-up studies,I want my email to be entered into the $10 Amazon gift card raffle
R_2ALSLa72egR2uYJ;Yes;Yes;Yes;Yes;Columbian College of Arts & Sciences;;Student;;No;Graduate (M.S.E, M.S., M.A, M.F.A., etc.);;I have a text file that logs my different passwords;I stored my passwords in a digital file or files,I saved my passwords in the browser (for example, passwords saved in Chrome);Yes;No;No;Yes;;;I allow certain sites, like NYT or Gmail, to retain my passwords upon revisiting them, since I do so often. I require other sites, like my bank accounts or less frequented sites, to have me enter a password every time.;Nope.;"I know this isn't true randomness, but I ""arbitrarily"" hit letters, numbers and symbols on my keypad to generate a new password for GW.";To ensure it is different enough from prior passwords for other sites.;No;Somewhat more secure;"I think it's similar to other account passwords in terms of ""randomness,"" but it's not reused for any other site, like some of my other ones are.";I save my passwords in the browser (for example, passwords saved in Chrome).;21.105;21.105;24.331;1;Media (Internet, TV, radio, etc);;Somewhat Disagree;Strongly Disagree;Somewhat Disagree;Strongly Agree;Strongly Disagree;Strongly Disagree;Neither agree nor disagree;Somewhat Disagree;Convenience.;Chrome;;Moderately satisfied;I create the password myself, and the password manager stores it for me;Not having to type my passwords (autofill);;I have security concerns;;I don't know how securely Chrome stores my passwords.;;;;;;Slightly unlikely;Disagree;Neither agree nor disagree;Somewhat Agree;Disagree;Neither agree nor disagree;Disagree;None of the above;Low understanding;Medium understanding;Low understanding;Medium understanding;Medium understanding;Full Understanding;Man;;My age is:;33;No, not of Hispanic, Latino/a/x, or Spanish origin;White;;I am willing to be contacted via email for follow-up studies,I want my email to be entered into the $10 Amazon gift card raffle
R_UQ3MWruRPK9o5xf;Yes;Yes;Yes;Yes;Other;Faculty position that falls under the provost's office rather than a school;Full-time Faculty;;;;;Most of my passwords are the same, or some variation of the same depending on password requirements.;I used a system-provided password manager (for example, Apple's Keychain);Yes;;;;;Yes;;Nope;I actually have the same password since I started at GW in 2010. I made something easy to remember that fit the requirements.;Easy to remember.;Yes;Somewhat more secure;It combines different features and is different than any of my other passwords.;I save my passwords in the browser (for example, passwords saved in Chrome).,I use a system provided password manager (for example, Apple's Keychain).;23.628;28.803;37.99;2;Other People (friends, family, etc, but not at work);;Neither agree nor disagree;Neither agree nor disagree;Neither agree nor disagree;Strongly Agree;Strongly Disagree;Strongly Disagree;Somewhat Agree;Somewhat Agree;To remember passwords so I don't have to re-enter them so much.;Apple Keychain;;Moderately satisfied;I create the password myself, and the password manager stores it for me;Not having to type my passwords (autofill);;Entering passwords when password manager is not installed;;Sometimes I forget the passwords because I'm used to autofill.;;;;;;Extremely likely;Strongly Disagree;Somewhat Agree;Somewhat Agree;Disagree;Somewhat Agree;Somewhat Agree;None of the above;High understanding;High understanding;Medium understanding;High understanding;Medium understanding;Medium understanding;Woman;;My age is:;42;No, not of Hispanic, Latino/a/x, or Spanish origin;White;;I am willing to be contacted via email for follow-up studies,I want my email to be entered into the $10 Amazon gift card raffle
R_2ZVPjMUZF2CTvGk;Yes;Yes;Yes;Yes;School of Medicine & Health Sciences;;Staff (non-faculty/administrative);;;;;Associate them with events and keep them in my head.;I remembered my passwords without writing them down or storing them digitally,I saved my passwords in the browser (for example, passwords saved in Chrome);Yes;;;No;;;I just change characters around in the same password.;No;Events;Easy to update and remember across accounts;Yes;Somewhat more secure;It's a strategy to remember my accounts.;I save my passwords in the browser (for example, passwords saved in Chrome).;4.385;19.624;24.986;4;Other People (friends, family, etc, but not at work);;Neither agree nor disagree;Neither agree nor disagree;Neither agree nor disagree;Neither agree nor disagree;Neither agree nor disagree;Neither agree nor disagree;Neither agree nor disagree;Neither agree nor disagree;I don't use them.;Other;none;Extremely satisfied;I create the password myself and recall it without storing it in the password manager;Not having to type my passwords (autofill);;I have security concerns;;Yes;;;;;;Slightly likely;Neither agree nor disagree;Neither agree nor disagree;Agree;Neither agree nor disagree;Somewhat Agree;Somewhat Agree;None of the above;Full Understanding;Full Understanding;Medium understanding;Full Understanding;Full Understanding;High understanding;Woman;;My age is:;500;No, not of Hispanic, Latino/a/x, or Spanish origin;Prefer not to disclose;;None of the above
R_OP4tRCP5ca59T1f;Yes;Yes;Yes;Yes;School of Medicine & Health Sciences;;Staff (non-faculty/administrative);;;;;Let's just say: I don't do a very good job. I try to write them down, but don't always do so, or don't do it in a spot where I can later find it, etc. So I end up forgetting passwords and needing to reset them or using a couple over and over (which of course isn't wise).;I saved my passwords in the browser (for example, passwords saved in Chrome),I wrote my passwords down on paper or other physical media.;Yes;;;No;;;"Not very effectively. I use the ""paper and pen"" method far more frequently, and find saving in the browser to not work very well because I often use a couple of different browsers, then I have my personal cell phone and a personal ipad, so any password saved on my work computer browser won't be elsewhere.";Just that it is horrendously painful and time consuming.;I used a name, a number, an exclamation mark.;That is my standard strategy. I am more of a words than number person, so using an actual name or word plus a couple of numbers works better for me to hopefully remember the password.;No;Somewhat less secure;I have used my GW account password for other accounts.;I do not use a password manager.;8.692;39.21;39.824;6;I don’t know (don’t remember, not sure);;Neither agree nor disagree;Neither agree nor disagree;Neither agree nor disagree;Neither agree nor disagree;Neither agree nor disagree;Neither agree nor disagree;Neither agree nor disagree;Neither agree nor disagree;;;;;;;;;;;Because I am just not that tech savvy and my patience for anything tech related is very limited. For example, several people highly recommended LastPass, but I struggled to set it up, so I gave up.;No;;Sure, I can imagine, but only if adoption were very simple and didn't take much time. I would do it so that I don't have to remember or write down 1,000 different passwords.;;Neither likely nor unlikely;Somewhat Agree;Strongly Disagree;Somewhat Disagree;Neither agree nor disagree;Neither agree nor disagree;Disagree;None of the above;Medium understanding;Full Understanding;Medium understanding;Medium understanding;Low understanding;Medium understanding;Woman;;My age is:;45;No, not of Hispanic, Latino/a/x, or Spanish origin;White;;I am willing to be contacted via email for follow-up studies,I want my email to be entered into the $10 Amazon gift card raffle
R_2zvEU8aPO8pKvdP;Yes;Yes;Yes;Yes;Milken Institute School of Public Health;;Student;;No;Graduate (M.S.E, M.S., M.A, M.F.A., etc.);;I use the same password for all accounts.;I remembered my passwords without writing them down or storing them digitally;Yes;;;;;;;n/a;Same password I always use;Easier to keep up with;Yes;About equally secure;Works for other sites;I save my passwords in the browser (for example, passwords saved in Chrome).;4.102;12.097;43.695;3;I don’t know (don’t remember, not sure);;Neither agree nor disagree;Somewhat Agree;Neither agree nor disagree;Somewhat Agree;Somewhat Disagree;Neither agree nor disagree;Somewhat Agree;Neither agree nor disagree;so it's one less thing to worry about;Chrome;;Moderately satisfied;I create the password myself, and the password manager stores it for me;Not having to memorize passwords;;I have security concerns;;If someone hacks into my pw manager;;;;;;Moderately likely;Neither agree nor disagree;Neither agree nor disagree;Somewhat Agree;Somewhat Disagree;Neither agree nor disagree;Somewhat Disagree;None of the above;Medium understanding;Full Understanding;Medium understanding;Low understanding;Medium understanding;Low understanding;Woman;;My age is:;43;No, not of Hispanic, Latino/a/x, or Spanish origin;White;;I want my email to be entered into the $10 Amazon gift card raffle
R_2zeWvlntEG7P7qi;Yes;Yes;Yes;Yes;School of Medicine & Health Sciences;;Full-time Faculty;;;;;I use similar ones;I remembered my passwords without writing them down or storing them digitally,I used a third-party password manager (for example, Lastpass or Onepass),I wrote my passwords down on paper or other physical media.;Yes;;;;No;;By using similar passwords, I typically don't write them down, however since having a variety of different accounts and different computers one for work and one for personal, I have written a few done in a secure journal since I use very infrequent and on my home computer I have a program that provides an option to save your password if you choose to;no;A mixture of letters and numbers and a symbol that mean something to me personally so its easy to remember;I find that strategy is easy to remember the password as noted above;No;About equally secure;I use the same strategy for my other accounts, letters, numbers and a symbol;I use a third-party manager (for example, Lastpass or Onepass).;57.689;57.689;61.74;1;Other People (friends, family, etc, but not at work);;Neither agree nor disagree;Neither agree nor disagree;Somewhat Agree;Somewhat Agree;Strongly Disagree;Neither agree nor disagree;Somewhat Agree;Neither agree nor disagree;to help me remember password for infrequently used accounts. I don't use it all the time and not for all passwords;1Password;;Moderately satisfied;I create the password myself, and the password manager stores it for me;Not having to memorize passwords;;Saves passwords that I do not want to save;;Sometimes it prompts me to save when I don't want to;;;;;;Moderately likely;Agree;Agree;Agree;Agree;Agree;Somewhat Disagree;None of the above;Low understanding;Medium understanding;Low understanding;Medium understanding;Low understanding;Medium understanding;Woman;;My age is:;60;No, not of Hispanic, Latino/a/x, or Spanish origin;White;;I am willing to be contacted via email for follow-up studies,I want my email to be entered into the $10 Amazon gift card raffle
R_2WHyLgsmFbw1AAv;Yes;Yes;Yes;Yes;School of Medicine & Health Sciences;;Staff (non-faculty/administrative);;;;;I have a system of multiple letters, symbols and numbers that I use;I remembered my passwords without writing them down or storing them digitally,I saved my passwords in the browser (for example, passwords saved in Chrome);No;;;No;;;For stuff that I find annoying to save and have no safety concerns (i.e. patient information or my personal information) I store the passwords. I never save passwords to access the EMR.;no;I thought of my partner and used password based off him that no one would guess and I would always remember;because I was sick of resetting my password;No;Much more secure;because I dont like dealing with administration.;I do not use a password manager.;5.823;5.823;48.568;1;I don’t know (don’t remember, not sure);;Strongly Disagree;Strongly Disagree;Strongly Disagree;Strongly Agree;Strongly Disagree;Strongly Agree;Strongly Disagree;Strongly Agree;;;;;;;;;;;because I dont want other people to know my passwords;Yes;three years ago, I got a weird email with my account information that I had stored in a password manager;;no;Slightly likely;Neither agree nor disagree;Strongly Agree;Strongly Agree;Neither agree nor disagree;Strongly Agree;Strongly Agree;None of the above;Full Understanding;Full Understanding;Low understanding;Full Understanding;Low understanding;Medium understanding;Woman;;My age is:;29;No, not of Hispanic, Latino/a/x, or Spanish origin;White;;I want my email to be entered into the $10 Amazon gift card raffle
R_3dJSttncu8L5sbf;Yes;Yes;Yes;Yes;School of Engineering & Applied Science;;Student;;No;Professional (M.D., J.D., etc.);;PasswordSafe sync'd via Dropbox.;I used a third-party password manager (for example, Lastpass or Onepass);No;;;;Yes;;;PasswordSafe with the password file sync'd via Dropbox. There is no Cloud based aspect other than the transfer of the binary file for the AES256 encrypted password safe that is sync'd via Dropbox.;PasswordSafe random password generator using 20 chars.;It's the same strategy that I use for all my password creation. The entropy generator in PasswordSafe is better than my own mental entropy generator.;No;About equally secure;I use the same PasswordSafe generator with the same settings generally if allowed by the individual systems (e.g., 20 or so characters, lower/upper case chars, special chars, et cetera).;I use a third-party manager (for example, Lastpass or Onepass).;26.1;26.1;29.809;1;Work,Media (Internet, TV, radio, etc);;Strongly Agree;Somewhat Agree;Somewhat Agree;Somewhat Agree;Somewhat Disagree;Strongly Disagree;Neither agree nor disagree;Somewhat Agree;To prevent the re-use of passwords across multiple systems.;Other;PasswordSafe;Extremely satisfied;I let the password manager create and store the password;Having unique passwords;;Entering passwords on an incompatible device where the password manger cannot be installed;;There are times when I have to manually type the password into a system. One example is logging in a Roku to a streaming service and typing in a 20 char high entropy password can be a real pain with all the special characters.;;;;;;Moderately unlikely;Agree;Strongly Agree;Agree;Agree;Strongly Agree;Agree;I am majoring / have a degree in computer science or a closely related field;High understanding;High understanding;High understanding;High understanding;High understanding;High understanding;Man;;My age is:;51;No, not of Hispanic, Latino/a/x, or Spanish origin;White;;I am willing to be contacted via email for follow-up studies
R_1CyxUiOhXCdo9ra;Yes;Yes;Yes;Yes;Columbian College of Arts & Sciences;;Full-time Faculty;;;;;My net ID/single sign on has basically been the same password since I started working here. I use that password for any account I set up thats for something GW related unless for some reason I cannot. I know that's a bad system, but it's the system I use. My computer has a different password and it has to be changed periodically, so I manage that by writing my password on a post-it note and sticking it to the front of the computer. I have 2-step authentication set up wherever possible.;I remembered my passwords without writing them down or storing them digitally,I reset my password every time I log in rather than remembering my password,I saved my passwords in the browser (for example, passwords saved in Chrome),I wrote my passwords down on paper or other physical media.;Yes;;;Yes;;;it depends. I remember passwords that I use often, and when I do a good job of coming up with some weird association that I can remember (so, usually I'll use a line from a song to create a 15-20 character password by using the first letter of each word, and subbing numbers where appropriate. I try not to be too on the nose, but that way I get a longish string of apparent nonsense I can remember. So, like, for a website that sells bicycles I might choose a couple lines from a song I like that captures the emotional state I associate with riding bicycles). Accounts that I rarely use and don't care about--say for a store I think I may only ever buy something from once, or something--I'll have the browser create and remember the password, and then I'll just reset the password if I'm using a different device and the password doesn't transfer. I write a password down on a sticky note if it is device specific and I am irritated about the way the password security is set up preventing me from creating a password I can remember.;managing passwords is a nightmare and I always feel like the more secure a password is from a cybersecurity standpoint the more likely it is that I can't remember it, and also I don't have time to change my passwords every three months or whatever, good lord.;I used two lines from a song that captured the emotional state I associate with working at GW to create a 16-character string of letters and numbers;It seems reasonably random, is on the long side, and yet I can remember it.;No;Somewhat more secure;"I don't want a student hacking into my GW account. I mean, I don't remember that one in devices, and it is pretty long/random. It's not P4ssword, you know? It's more like, idk, etcamMwyHitt?Iwa455Rtvkyd. That's the sort of thing I use as my standard password (that is not an actual password I have ever used. It's just the sort of thing I would use). But then I'm bad about changing them very often, which I know I should. Also, I just always make my answer to security questions the same answer no matter what the question is, because otherwise I""m like ""hmm, would I have said my first pet was the cat my parents owned when I was a baby, or the cat was the first cat I personally picked out from the shelter, or would I have said the dog we got when I was five., who I remember and predated the cat I picked out, but wasn't really my personal pet"", which is a ridiculous way to spend your time and also a good way to get locked out of accounts.";I save my passwords in the browser (for example, passwords saved in Chrome).,I use a system provided password manager (for example, Apple's Keychain).;13.451;15.738;21.637;2;Media (Internet, TV, radio, etc),Other People (friends, family, etc, but not at work),Other;fiction;Somewhat Agree;Somewhat Agree;Somewhat Disagree;Somewhat Agree;Somewhat Disagree;Somewhat Agree;Neither agree nor disagree;Strongly Disagree;I got exhausted by coming up with and remembering minor passwords, and my devices started offering to do it, and it seemed better than writing them down.;Apple Keychain;;Moderately satisfied;I create the password myself and recall it without storing it in the password manager;Generate strong passwords;;Other;It depends on the situation, but mostly that I don't understand how they work, and they create a problem when they don't transfer across devices.;I feel like I explained it.;;;;;;Neither likely nor unlikely;Somewhat Disagree;Somewhat Disagree;Somewhat Agree;Somewhat Disagree;Somewhat Agree;Neither agree nor disagree;None of the above;Full Understanding;Full Understanding;Low understanding;High understanding;Medium understanding;Medium understanding;Woman;;My age is:;43;No, not of Hispanic, Latino/a/x, or Spanish origin;White;;I am willing to be contacted via email for follow-up studies,I want my email to be entered into the $10 Amazon gift card raffle
R_3fNMRXD2gsR08fF;Yes;Yes;Yes;Yes;Columbian College of Arts & Sciences;;Full-time Faculty;;;;;I save them in a word document for reference;I saved my passwords in the browser (for example, passwords saved in Chrome),I used a system-provided password manager (for example, Apple's Keychain),I wrote my passwords down on paper or other physical media.;Yes;;;Yes;;Yes;I use each of these strategies because together they help me avoid having to reset passwords too frequently.;No;I combined letters and numbers that made sense to me but that wouldn't to anyone else.;Because it was considered a strong password and it was one I could remember easily.;Yes;About equally secure;I try to create passwords that are pretty secure regardless of the platform.;I save my passwords in the browser (for example, passwords saved in Chrome).,I use a system provided password manager (for example, Apple's Keychain).;9.479;11.492;21.476;2;I don’t know (don’t remember, not sure);;Neither agree nor disagree;Neither agree nor disagree;Neither agree nor disagree;Strongly Agree;Strongly Disagree;Strongly Disagree;Neither agree nor disagree;Neither agree nor disagree;Ease of access to platforms that I use regularly;Chrome;;Extremely satisfied;I create the password myself, and the password manager stores it for me;Synchronizing passwords for access across multiple devices;;I have security concerns;;I think internet security is generally a concern.;;;;;;Extremely likely;Neither agree nor disagree;Agree;Agree;Disagree;Neither agree nor disagree;Somewhat Disagree;None of the above;High understanding;High understanding;Low understanding;Low understanding;Medium understanding;Medium understanding;Woman;;My age is:;48;No, not of Hispanic, Latino/a/x, or Spanish origin;White;;I want my email to be entered into the $10 Amazon gift card raffle
R_3nduoTJqIFT9JoL;Yes;Yes;Yes;Yes;Columbian College of Arts & Sciences;;Staff (non-faculty/administrative);;;;;Regarding GW accounts, there are really only two passwords required -- one associated with the netid (email address), and one associated with the Gweb. I update those passwords when required to. The single-signon options now in place have removed a number of the other passwords I needed to manage in past.;I remembered my passwords without writing them down or storing them digitally,I saved my passwords in the browser (for example, passwords saved in Chrome),I wrote my passwords down on paper or other physical media.;No;;;No;;;"For the most part, I use the first technique. 
 I use the second strategy when it is automatic (but I rarely *choose* to save my passwords in a browser). In other words, some programs simply open when I click on them, so I presume the password has been saved somewhere.
 Occasionally (very rarely these days), when I find that I need to create a password that will only be used for a very specific program (i.e. does not benefit from the single-signon system), I might write it down if I know I'm going to have to use it again soon and it is a trickier than usual (for me) combination. I would say that if someone searched through the *volumes* of paper in and around my desk and ultimately found maybe 10 passwords written down, none of them at this point would be valid.
 Long story short, single sign-on has made my life much easier.";Nothing beyond what I just wrote.;I use an alphanumeric mnemonic combined with my preferred symbol.;"I find it works for me and passwords that I have created using my system generally receive the green ""strong"" approval from applications.";No;About equally secure;I like to be able to remember my passwords, and prefer not to use yet *another* system (password walllet, e.g) to hold passwords that are (to me) pure jibberish.;I do not use a password manager.;2.996;51.812;52.972;7;Media (Internet, TV, radio, etc),Other People (friends, family, etc, but not at work);;Neither agree nor disagree;Neither agree nor disagree;Neither agree nor disagree;Neither agree nor disagree;Neither agree nor disagree;Neither agree nor disagree;Somewhat Disagree;Somewhat Agree;;;;;;;;;;;I would like control my own password(s);No;;If I am required to, I will do so.;;Slightly unlikely;Agree;Somewhat Agree;Somewhat Agree;Somewhat Agree;Neither agree nor disagree;Disagree;None of the above;Medium understanding;Medium understanding;Medium understanding;Medium understanding;Medium understanding;Medium understanding;Woman;;My age is:;61;No, not of Hispanic, Latino/a/x, or Spanish origin;White;;I am willing to be contacted via email for follow-up studies,I want my email to be entered into the $10 Amazon gift card raffle
